id,question
0,How do I write a SQL query to display all products, even those with zero sales?
0,What is the purpose of using COALESCE in SQL queries?
0,Can you explain the difference between INNER JOIN and LEFT JOIN in SQL?
0,How can I sort the results of my SQL query in descending order?
0,What are common mistakes when aggregating data from multiple tables in SQL?
1,How can I optimize a query that ranks products by sales in SQL?
1,What are the advantages of using Common Table Expressions (CTEs) in SQL queries?
1,Can you explain the difference between ROW_NUMBER(), RANK(), and DENSE_RANK() functions in SQL?
1,How do you filter records by date in SQL, especially for quarterly reports?
1,What are the best practices for handling joins between multiple tables in SQL?
2,What SQL query can be used to identify employees without any direct reports?
2,How can I join multiple tables in SQL to gather data on employees and their departments?
2,What common mistakes should I watch for when using LEFT JOINs in SQL?
2,Can you explain the concept of filtering using NULL values in SQL joins?
2,What are the best practices for structuring a query that involves multiple joins in SQL?
3,What SQL techniques can I use to calculate total revenue from different tables?
3,How can I filter query results for a specific year in SQL?
3,What considerations should I keep in mind when using aggregate functions in SQL?
3,How do I properly use JOIN in SQL to combine data from multiple tables?
3,What is the significance of the HAVING clause in SQL, and how does it differ from the WHERE clause?
4,How do I write a query to aggregate sales data from multiple tables in SQL?
4,What is the best way to filter records based on a date range in SQL?
4,Can you explain the importance of using JOINs in SQL queries?
4,What common errors should I watch out for when creating aggregate queries?
4,How can I modify the SQL query to include additional product information in the results?
5,How do I write a query to find the total number of employees in each department along with the department names?
5,What are the key differences between INNER JOIN and LEFT JOIN when querying employee and department data?
5,Can you explain how the GROUP BY clause works in conjunction with aggregate functions like AVG()?
5,What would be the impact of not using ORDER BY in the SQL query provided?
5,How do I modify the query to include only departments with an average salary greater than a specific value?
6,What is the purpose of using a Common Table Expression (CTE) in the SQL query provided?
6,Can you explain the difference between the HAVING clause and the WHERE clause in SQL?
6,How would you adjust the query to show departments with an average salary less than $50,000?
6,What changes would you make to include the total salary paid to employees in each department?
6,How can you include additional filters, such as only considering departments with more than 10 employees?
7,How do I calculate the average salary for each department in SQL?
7,What SQL functions are necessary to find the maximum value from an aggregated result set?
7,Can you explain the purpose of using Common Table Expressions (CTEs) in SQL queries?
7,What should I consider when handling ties in aggregated results during SQL querying?
7,How do I format the output to show both department names and their corresponding average salaries in SQL?
8,How can I modify the query to show the top 10 products instead of the top 5?
8,What SQL techniques can I use to improve the performance of this query for large datasets?
8,Could you explain how to filter the results to only include products with total revenue above a certain threshold?
8,What adjustments would be necessary to analyze sales data by month rather than by quarter?
8,How do I handle situations where there are no sales records for a product in the last quarter?
9,How do you calculate total sales for products using SQL?
9,What is the purpose of using a CTE in SQL queries?
9,Can you explain how the window function ROW_NUMBER() works in this context?
9,What adjustments would you make to this query to find the top 5 products instead of top 3?
9,How would you modify the query to include products with zero sales in the results?
10,What is the purpose of using the JOIN clause in this SQL query?
10,How can I modify the query to include customers who have never placed an order?
10,What aggregate functions are used in the provided SQL statement and what do they calculate?
10,Can you explain how the GROUP BY clause is functioning in this context?
10,What methods can I use to optimize the performance of this SQL query?
11,How can I modify the query to include only customers with a total order amount exceeding a specific threshold?
11,What are some common pitfalls when using joins and group by in SQL aggregations?
11,Can you explain how window functions like RANK() differ from regular aggregate functions?
11,What changes would be necessary to sort the results in ascending order instead of descending?
11,Are there alternative ways to rank customers based on their total order amounts without using the RANK() function?
12,How can I modify the query to include customers who joined before January 1, 2020?
12,What happens if there are multiple orders for the same customer in the orders table?
12,Can you explain the purpose of the HAVING clause in this SQL query?
12,What are the potential performance implications of using JOIN and GROUP BY in this scenario?
12,How would I change the query to show total spending for all customers, regardless of their signup date?
13,How do I write a query to calculate the total sales for each product along with the number of transactions in SQL?
13,What are the differences between using HAVING and WHERE clauses in SQL queries?
13,Can you explain how to use JOINs in SQL to combine data from multiple tables?
13,What are common errors to avoid when grouping data in SQL queries?
13,How would I modify the query to also include the category of each product in the results?
14,How can I compute total sales for a specific time period using SQL?
14,What are the common pitfalls when using JOINs in SQL queries?
14,What SQL functions are useful for aggregating data?
14,How do I group results by a specific column in SQL?
14,What SQL clause can I use to sort query results based on a computed value?
15,How do you write a SQL query to calculate the average salary for each department?
15,What is the purpose of using a Common Table Expression (CTE) in SQL?
15,Can you explain how to use JOINs effectively in SQL queries?
15,What are common performance considerations when using GROUP BY in SQL?
15,How do you find rows with the maximum value in a derived table in SQL?
16,How can I write a SQL query to calculate total sales for managers with direct reports?
16,What is the purpose of using a Common Table Expression (CTE) in SQL queries?
16,Can you explain how to join two tables based on a common column in SQL?
16,What SQL aggregate functions can be used to sum values and count records?
16,How do I filter query results based on specific conditions in SQL?
17,What is the difference between INNER JOIN and LEFT JOIN in SQL?
17,How can I ensure that employees without departments still appear in my query results?
17,What is the purpose of the COALESCE function in SQL?
17,Can you explain how to sort query results in SQL?
17,What common mistakes should I avoid when writing SQL queries with joins?
18,How can I structure a SQL query to combine data from two related tables?
18,What is a Common Table Expression (CTE) and how is it used in SQL?
18,Can you explain how to filter results based on a specific date condition in a SQL query?
18,What is the best way to sort query results based on aggregate values in SQL?
18,How do I calculate total sums for grouped data using SQL?
19,What is the purpose of using a LEFT JOIN in this query?
19,How can you modify the query to include only customers who have placed at least one order?
19,What are the implications of using GROUP BY in SQL queries with aggregate functions?
19,Can you explain the difference between INNER JOIN and LEFT JOIN in the context of this scenario?
19,What common errors should be avoided when writing aggregate queries in SQL?
20,How can I calculate the average salary for each department in SQL?
20,What is the purpose of using JOIN in SQL queries?
20,How do I filter results based on a condition in SQL?
20,What aggregate functions can I use in SQL queries to summarize data?
20,How do I ensure that only departments with a minimum number of employees are included in my query results?
21,How do I write a SQL query to join two tables and filter results based on aggregate conditions?
21,What SQL functions can I use to calculate total spending and identify the earliest order date for customers?
21,Can you explain the purpose of the HAVING clause in SQL and how it differs from WHERE?
21,What mistakes should I avoid when using GROUP BY and aggregate functions in SQL queries?
21,How can I limit query results based on the number of occurrences in a grouped dataset?
22,How do you perform a LEFT JOIN between two tables in SQL?
22,What SQL function is used to count the number of records in a group?
22,How can you ensure that all departments are included in the result even if they have no associated employees?
22,What is the purpose of the GROUP BY clause in an aggregate query?
22,How do you sort the results of a SQL query based on a specific column?
23,How do you calculate the average salary of employees while excluding those who earn above the department's average?
23,What is a Common Table Expression (CTE) and how is it used in SQL queries?
23,Can you explain the importance of using JOINs when working with multiple tables in an SQL query?
23,What common mistakes do candidates make when writing SQL queries involving averages and filters?
23,How would you modify this query to include only departments with more than 5 employees?
24,What SQL functions are used to calculate the total number of employees in the provided query?
24,How does a LEFT JOIN differ from an INNER JOIN in the context of this SQL query?
24,Can you explain the purpose of the subquery in calculating the employee percentage?
24,What would be the outcome if there are departments without any employees in this query?
24,How can I modify this query to group results by `department_id` instead of `department_name`?
25,What is the significance of using JOIN in SQL queries when working with multiple tables?
25,Can you explain how to filter results by a specific year in a SQL query?
25,What are some common errors to avoid when writing aggregate functions in SQL?
25,How does the GROUP BY clause work in SQL, and why is it necessary for this query?
25,Why is it important to order query results, and what syntax is used for ordering in SQL?
26,How can I write a SQL query to get the top N highest salaries from multiple departments?
26,What is the purpose of the ROW_NUMBER() function in SQL?
26,Can you explain how to use a Common Table Expression (CTE) in SQL with an example?
26,What are the differences between ROW_NUMBER(), RANK(), and DENSE_RANK() in SQL?
26,How would you modify the query to include employees with the same salary in the top 3 results?
27,How can I write a SQL query to retrieve customers with the highest spending based on order amounts?
27,What SQL techniques can be used to group and summarize data from multiple tables?
27,Could you explain the purpose of using a Common Table Expression (CTE) in SQL queries?
27,What is the significance of ordering results in descending order when retrieving top results from a table?
27,How would I modify the query to get the top 10 customers instead of top 5?
28,How do you write a SQL query to calculate average values from joined tables?
28,What is the difference between the WHERE clause and the HAVING clause in SQL?
28,Can you explain how GROUP BY works with aggregate functions in SQL?
28,What SQL techniques can be used to filter out results based on aggregate calculations?
28,How would you modify the query if you wanted to include departments with an average salary less than $60,000?
29,How do I write a SQL query to calculate totals from multiple tables using joins?
29,What are common mistakes to avoid when aggregating data in SQL?
29,Can you explain how to filter records by date in SQL queries?
29,What does the INTERVAL keyword do in SQL date calculations?
29,How can I sort query results based on an aggregate function in SQL?
30,What is the purpose of using the JOIN clause in the provided SQL query?
30,How does the GROUP BY clause function in the context of this query?
30,What would be the expected output if there are fewer than five customers in the database?
30,Can you explain the significance of the LIMIT clause in this SQL query?
30,How might the query change if we wanted to find the top customers based on a specific date range?
31,How can I optimize SQL queries that involve joining multiple tables?
31,What techniques can I use to analyze aggregate data in SQL?
31,What are common mistakes to avoid when writing SQL queries for sales analysis?
31,How do I handle NULL values when calculating aggregates in SQL?
31,What are some strategies for sorting query results effectively in SQL?
32,What is the purpose of using JOIN in the SQL query for this scenario?
32,How do we filter groups in SQL using HAVING after an aggregation?
32,Can you explain how to calculate the average salary for each department in SQL?
32,What would be the effect of removing the ORDER BY clause in this query?
32,How can you modify the query to display departments with an average salary below $70,000 instead?
33,How do I write a SQL query to calculate the total salary expenditure in each department?
33,What is the difference between WHERE and HAVING in SQL?
33,Can you provide an example of using a JOIN with multiple tables?
33,How can I exclude certain groups from the result set based on aggregated values?
33,What are common aggregation functions in SQL and how are they used?
34,How can I write a query to join two tables in SQL?
34,What is the purpose of the HAVING clause in SQL?
34,How do I calculate the average of a specific column in SQL?
34,In SQL, how can I filter results based on aggregated values?
34,What are common errors to avoid when writing SQL queries for aggregations?
35,How do you perform a join operation between two tables in SQL?
35,What SQL function is used to calculate the average of a numeric column?
35,In SQL, how do you group results based on a specific column?
35,What is the syntax for ordering the results of a SQL query?
35,Can you explain how to retrieve specific columns from a result set in an SQL query?
36,How do I write a SQL query to retrieve the highest spending customers from a specific time frame?
36,What is a Common Table Expression (CTE) and how is it used in SQL for aggregating data?
36,Can you explain how to join two tables in SQL to analyze related data?
36,What SQL functions can I use to filter records based on dates in my queries?
36,How can I limit the number of results returned by an SQL query to focus on the top records?
37,What SQL techniques can be used to analyze customer spending over a specific period?
37,How do you correctly join two tables to aggregate data based on certain columns?
37,What are the best practices for using Common Table Expressions in SQL queries?
37,Can you explain how to filter records based on date functions in SQL?
37,What common mistakes should be avoided when writing aggregate queries in SQL?
38,How can I write a SQL query to calculate the total spending of customers without using CTEs?
38,What are the common mistakes to avoid when writing aggregate queries involving multiple tables?
38,Can you explain how to join two tables in SQL to retrieve related data?
38,How do I limit the number of rows returned by a SQL query while using ORDER BY?
38,What strategies can I use to improve the readability of complex SQL queries?
39,How can I retrieve customer information along with their order details from multiple tables?
39,What SQL functions can be used to calculate totals and counts in a query?
39,How do I filter records based on a date condition in SQL?
39,What is the significance of using LEFT JOIN in this query?
39,How can I modify this query to include additional customer information, such as signup date?
40,How do you write a query to aggregate sales data while filtering based on join dates?
40,What SQL functions can be used to truncate dates to a specific level of precision?
40,Can you explain how to join two tables and aggregate results based on a condition?
40,What steps should you follow to ensure you are excluding certain records from your SQL query?
40,What is the significance of grouping by multiple columns in an SQL query?
41,How do you perform a join between two tables in SQL?
41,What is the purpose of the GROUP BY clause in SQL queries?
41,How can I filter results based on aggregate functions in SQL?
41,What SQL command is used to calculate the average of a numerical column?
41,How do you sort query results in ascending order by a specific column?
42,How can I count the number of employees in each department using SQL?
42,What SQL statement can be used to find the average salary of employees across multiple departments?
42,Can you explain how to filter out departments with a specific number of employees in SQL?
42,What does the SQL JOIN clause do when used with multiple tables?
42,How do you order results in SQL based on a calculated average value?
43,How can I adjust the query to include all customers who spent the same amount as the third highest spender?
43,What modifications would be needed to find customers who spent the most over multiple years?
43,Can you explain the significance of using the JOIN clause in this query?
43,How do I ensure that my SQL query is optimized for performance when working with large datasets?
43,What are some common mistakes to avoid when writing aggregate functions in SQL?
44,How can I calculate the total spending of customers in SQL?
44,What SQL functions are needed to count the number of orders per customer?
44,How do I sort SQL query results by a specific column in descending order?
44,Can you explain how to join two tables in SQL and the purpose of the ON clause?
44,What are common pitfalls when using GROUP BY in SQL queries?
45,How do I write a SQL query that summarizes sales data by category over a specific time frame?
45,What is the best way to identify the product category with the highest sales using SQL?
45,Can you explain how to use Common Table Expressions (CTEs) in aggregating data from multiple tables?
45,What SQL functions can I use to filter results based on date ranges in sales analysis?
45,How can I optimize a SQL query that joins two tables for reporting purposes?
46,How can I calculate the sales made by an employee during a specific period in SQL?
46,What is the purpose of using a Common Table Expression (CTE) in SQL queries?
46,Can I filter results based on dates in SQL, and if so, how?
46,What SQL functions are used to aggregate data, and how can they be applied in queries?
46,In SQL, how do I sort query results in a specific order after aggregation?
47,How do I join a table to itself in SQL to retrieve hierarchical data?
47,What SQL functions can be used to compute averages in a result set?
47,Can you explain how to group results in SQL and why it's important?
47,What is the significance of sorting query results, and how is it done in SQL?
47,What are some common mistakes to avoid when writing SQL queries that involve multiple joins?
48,How can I optimize the SQL query to improve performance when calculating total sales amounts?
48,What are the key differences between aggregate functions and window functions in SQL?
48,Can you explain the purpose of using Common Table Expressions (CTEs) in SQL queries?
48,What common errors should I watch out for when using the ROW_NUMBER() function in my SQL queries?
48,How would I adjust the query to return the top 5 products instead of the top 3 for each category?
49,What SQL functions are used to calculate total sales per category in a given year?
49,How do you perform a join between two tables in SQL?
49,What are the most common mistakes to avoid when writing SQL queries for data aggregation?
49,What is the significance of the GROUP BY clause in SQL queries?
49,How can you modify the query to include only products with sales above a certain threshold?
50,How do I write a SQL query to count records from multiple tables?
50,What is the purpose of using a LEFT JOIN in SQL?
50,How can I filter grouped results based on aggregate functions?
50,What are common mistakes to avoid when using GROUP BY in SQL?
50,How do I identify teams with a specific number of employees using SQL?
51,How can I calculate the average salary of employees grouped by department in SQL?
51,What are Common Table Expressions (CTEs) and how are they used in SQL queries?
51,Can you explain how to join two tables in SQL to retrieve related information?
51,What is the significance of ordering results in SQL and how can it be implemented?
51,What are some common errors to avoid when writing aggregate functions in SQL queries?
52,What are Common Table Expressions (CTEs) and how are they used in SQL queries?
52,Can you explain how the RANK() window function differs from other ranking functions in SQL?
52,What is the purpose of the JOIN operation in combining the products and sales tables?
52,How would you modify the query to display only the top-selling product in each category?
52,What common mistakes should I avoid when writing SQL queries that involve aggregating and ranking data?
53,What SQL functions can be used to filter records based on date ranges?
53,How do you perform a ranking of results in SQL?
53,Can you explain the importance of using joins in SQL queries?
53,What common errors should be avoided when aggregating data in SQL?
53,How can you modify a query to return different time periods for revenue analysis?
54,How can I effectively use LEFT JOINs to include records from one table that may not have matching entries in another table?
54,What is the purpose of the COALESCE function in SQL, and how can it be utilized in queries?
54,Can you explain how to aggregate data in SQL while ensuring you include entries with null values in related tables?
54,What strategies can I use to group data in SQL while handling missing relationships between tables?
54,How do I sort results in SQL based on aggregated values, especially when dealing with multiple records for individual entries?
55,How can I write a SQL query to filter sales data for a specific year?
55,What is the purpose of joining tables in SQL when calculating totals?
55,How do I use aggregate functions to compute revenue in SQL?
55,What is the significance of using GROUP BY in a SQL query?
55,Can SQL queries be optimized for performance when calculating large datasets?
56,How can I optimize this SQL query for better performance?
56,What are some common pitfalls to avoid when using JOINs in SQL?
56,Can you explain the purpose of using a Common Table Expression (CTE) in this context?
56,How would the query change if we needed to include only managers with at least one sale?
56,What functions are available in SQL for handling date ranges effectively?
57,How can I modify the SQL query to include sales data for a different time period, such as the last week?
57,What are the advantages of using a Common Table Expression (CTE) in SQL queries?
57,Can you explain how the COALESCE function works in this context and provide an example?
57,What would be a strategy to handle scenarios where the sales table or products table is empty?
57,How does joining multiple tables affect query performance and what are some optimization techniques?
58,How can I filter records in SQL based on a specific date range?
58,What is the purpose of using Common Table Expressions (CTE) in SQL queries?
58,What SQL functions can I use to calculate total sales for each customer?
58,How do I perform joins between two tables to combine relevant data?
58,What steps should I take to find the top N records based on aggregated values in SQL?
59,How do I write a query to find customers with zero sales in SQL?
59,What is the purpose of the COALESCE function in the provided SQL example?
59,Can you explain the difference between INNER JOIN and LEFT JOIN in this context?
59,What SQL clause is used to group and aggregate data in the query?
59,How can I modify the query to include additional customer details in the result?
60,How do I filter records by a specific date range in SQL?
60,What is the purpose of using a Common Table Expression (CTE) in SQL queries?
60,Can you explain how the RANK() function works in SQL and its usage in queries?
60,What are the common pitfalls when joining tables in SQL?
60,How can I aggregate data from multiple tables and rank the results in SQL?
61,How do I calculate total sales grouped by a specific identifier in SQL?
61,What are the differences between RANK(), DENSE_RANK(), and ROW_NUMBER() in SQL?
61,Can you explain how to use Common Table Expressions in SQL queries?
61,What is the purpose of using JOIN statements in SQL, and how do they affect query results?
61,How can I sort and rank aggregated data in descending order using SQL?
62,What is the importance of using Common Table Expressions (CTEs) in SQL queries?
62,How can you modify the given query to find the top 5 products instead of the top 3?
62,What might cause an error in joining the sales and products tables in SQL?
62,How do you filter records based on time periods in SQL?
62,What are common performance issues to watch out for when writing complex SQL queries?
63,How do I formulate an SQL query to retrieve customer spending based on signup dates?
63,What are common pitfalls to avoid when joining multiple tables in SQL?
