id,question
125,Can you explain the use of the GROUP BY clause in aggregate functions?
125,What are the common errors to avoid when dealing with SQL date functions?
125,How can I sort query results in ascending or descending order using SQL?
126,What is the purpose of joining the `sales` and `products` tables in the given query?
126,How do aggregate functions work in SQL, and why are they used in this context?
126,Can you explain how to filter results for a specific year in a SQL query?
126,What might be some common pitfalls when writing SQL queries involving joins and aggregations?
126,How can the query be modified to include additional filters, such as only specific product categories?
127,How do I write a SQL query to find the highest spending customers in a sales database?
127,What SQL functions are used to aggregate order totals per customer?
127,How can I sort query results by multiple columns in SQL?
127,What is the purpose of the JOIN clause in SQL when accessing related tables?
127,How do I limit the number of rows returned by a SQL query?
128,How do you use Common Table Expressions in SQL queries?
128,What is the process to find the maximum value in a grouped dataset using SQL?
128,Can you explain the purpose of joining multiple tables in a SQL query?
128,What are some common mistakes to avoid when writing SQL queries for maximum values?
128,How can you adapt this query to return additional employee details along with their salary?
129,What are the steps to find customers who registered in the past year using SQL?
129,How can I aggregate total spending for a specific customer group in SQL?
129,What is the purpose of using Common Table Expressions (CTEs) in SQL queries?
129,Can you explain how to join multiple tables in SQL while filtering specific records?
129,What are some common pitfalls when writing aggregate functions with joins in SQL?
130,What is the purpose of using a LEFT JOIN in the provided SQL query?
130,How does the query aggregate sales data based on employee performance?
130,Can you explain the significance of grouping by employee and manager names in the query?
130,What will be the result if an employee has no sales recorded in the sales table?
130,How does the query ensure that the results are sorted by total sales in descending order?
131,How can I write a query to calculate the average salary for each department from two related tables?
131,What SQL techniques can help when handling ties in average salary calculations?
131,Could you explain how to use Common Table Expressions (CTE) in SQL queries?
131,What are some common mistakes to avoid when calculating averages using SQL joins?
131,How do I structure a SQL query to return multiple results when there are ties in aggregate functions?
132,How can I modify the SQL query to filter sales for a specific month in 2023?
132,What are the common mistakes to avoid when constructing SQL queries that involve joins and aggregates?
132,Can you explain how the GROUP BY clause works in the context of this query?
132,What SQL functions can be used to calculate totals in different scenarios besides SUM?
132,How would you optimize this query if the sales database grows significantly?
133,What SQL statements are used to perform a join between two tables?
133,How do you filter results based on aggregate functions in SQL?
133,Can you explain the purpose of the 'HAVING' clause in an SQL query?
133,What is the difference between 'JOIN' and 'GROUP BY' in SQL?
133,How would you modify the query to include departments with exactly five employees instead of more?
134,What is the purpose of using JOIN in the SQL query for sales data analysis?
134,How does the GROUP BY clause function in the context of this query?
134,What does the HAVING clause achieve in the provided SQL query?
134,Why is it important to sort the results in descending order when analyzing total sales?
134,Can you explain the significance of filtering regions with total sales greater than $10,000?
135,How do you calculate the average salary per department in SQL?
135,What is the role of Common Table Expressions in SQL queries?
135,Can you explain the difference between JOIN and subquery in SQL?
135,What are some common pitfalls when calculating averages in SQL?
135,How do you filter results based on aggregated values in SQL?
136,What SQL functions are useful for calculating year-over-year percentage changes in sales data?
136,How can I join multiple tables in SQL to extract relevant data for analysis?
136,What is the importance of using Common Table Expressions (CTE) in complex SQL queries?
136,How do window functions like LAG work in SQL, and when should I use them?
136,What are some common mistakes to avoid when writing SQL queries for sales reporting?
137,What is the purpose of using a JOIN in SQL queries?
137,How do you group data in SQL to calculate totals?
137,What aggregate functions can be used in SQL besides SUM?
137,How can I order query results based on aggregated values?
137,What are some common pitfalls when writing SQL queries that involve multiple tables?
138,How can I write a SQL query to calculate average values from joined tables?
138,What are some common SQL functions to use with aggregate data?
138,Can you explain how to properly use GROUP BY with JOIN clauses in SQL?
138,What strategies can I employ to avoid mistakes when writing SQL queries involving multiple tables?
138,How do I interpret the results of an SQL query that involves aggregation and joining different data sources?
139,How do I join two tables in SQL to filter specific data?
139,What is the purpose of using the SUM function in SQL aggregate queries?
139,How can I filter records based on a specific year in a date column?
139,What SQL concepts should I understand to analyze sales data effectively?
139,Can you explain how grouping works in SQL and why it's necessary in this context?
140,What are common mistakes to avoid when writing queries that involve GROUP BY and JOINS in SQL?
140,How can I effectively use Common Table Expressions (CTEs) to simplify complex SQL queries?
140,What are the best practices for optimizing SQL queries that involve aggregations and filtering?
140,Can you provide examples of different scenarios where calculating average values in SQL is necessary?
140,How do I handle NULL values when calculating averages in SQL queries?
141,How can I calculate the total salary of employees in each department using SQL?
141,What are some common mistakes to avoid when using JOINs in SQL queries?
141,Can you explain how the GROUP BY clause works in aggregate functions?
141,What is the purpose of the ORDER BY clause in SQL, and how does it affect the query results?
141,How would you modify the given query to find the minimum and maximum salaries within each department?
142,What is the purpose of the JOIN clause in the provided SQL query?
142,How does the GROUP BY statement affect the output of the SQL query?
142,Can you explain the difference between WHERE and HAVING in the context of this query?
142,What other SQL functions could be used to analyze employee data in similar scenarios?
142,How would you modify the query to include departments with exactly 5 employees instead?
143,How can I modify the SQL query to include only departments that have employees?
143,What is the significance of using LEFT JOIN in this SQL query?
143,Can you explain how the GROUP BY clause works in this context?
143,What other aggregate functions could be applied to the employee salary data?
143,How would the query change if I wanted to filter departments by specific criteria like those with salaries above a certain threshold?
144,How do you write a query to calculate total sales for a specific period using multiple tables?
144,What are the common errors when joining tables in SQL for revenue calculations?
144,Can you explain the purpose of a Common Table Expression (CTE) in SQL queries?
144,What approach would you take to order results by calculated fields like revenue?
144,How would you handle filtering data by date in SQL queries effectively?
145,How can I calculate total sales by city using an SQL query?
145,What SQL functions are needed to rank cities based on their sales totals?
145,Can you provide an example of using a Common Table Expression (CTE) in SQL for aggregating data?
145,What are some common mistakes to avoid when writing SQL queries that include joins and window functions?
145,How do aggregate functions work in conjunction with GROUP BY in SQL?
146,How can I calculate the total salary for employees in a specific department using SQL?
146,What SQL functions are used to aggregate data when working with multiple tables?
146,Can you explain how to join two tables in SQL and aggregate their data?
146,What are common pitfalls to avoid when writing SQL queries that involve grouping and ordering results?
146,In which scenarios would I need to use both SUM and COUNT functions in an SQL query?
147,How do you join two tables in SQL to retrieve data based on common columns?
147,What is the purpose of the HAVING clause in a SQL query?
147,How can you calculate the average of a numeric column in SQL?
147,In SQL, how do you filter aggregated results after grouping?
147,What considerations should be taken when defining salary thresholds in a query?
148,What are the steps involved in writing a SQL query that requires joining multiple tables?
148,How can I filter data in SQL based on date ranges?
148,What is the purpose of using a Common Table Expression (CTE) in SQL queries?
148,How do aggregate functions work in SQL, and what are some common examples?
148,What are the best practices for ordering query results in SQL?
149,What are the best practices for using Common Table Expressions (CTEs) in SQL queries?
149,How can I modify the SQL query to include data for a specific product category?
149,What SQL functions can I use to analyze sales data over different time periods?
149,What are some common mistakes to avoid when joining multiple tables in SQL?
149,How do I optimize this query for large datasets in SQL?
150,How can I perform aggregations over joined tables in SQL?
150,What are the best practices for writing SQL queries that involve GROUP BY clauses?
150,Can you explain how JOIN operations work with multiple tables in SQL?
150,What are common pitfalls when sorting results of an aggregated SQL query?
150,How do I optimize SQL queries that involve summing large datasets?
151,How can I write a SQL query to calculate the average salary for departments with a specific number of employees?
151,What are Common Table Expressions (CTEs) and how are they used in SQL queries?
151,Can you explain how to filter results based on aggregation in SQL?
151,What joins are necessary to combine data from multiple tables to get departmental averages?
151,What SQL functions are useful for calculating averages and counts in queries?
152,What SQL functions can be used to aggregate data across different categories in a table?
152,How do you perform a JOIN operation between two tables in SQL?
152,What are some common mistakes to avoid when writing GROUP BY clauses in SQL?
152,How can you filter records based on a specific date range in SQL?
152,What is the significance of ordering results in SQL queries and how is it done?
153,How can I modify the query to filter results for a specific product category?
153,What SQL functions are involved in calculating total sales and average price in the given query?
153,Can you explain the purpose of the JOIN clause in this SQL query?
153,How would the query change if I wanted to include sales from the last 60 days instead of 30?
153,What are some common pitfalls to avoid when writing SQL queries that involve grouping and aggregation?
154,What SQL techniques are useful for calculating total revenue across multiple tables?
154,How can I modify a query to include only products that have sales in a specific time frame?
154,What are the common pitfalls to avoid when using JOINs in SQL queries?
154,Can you explain how to use Common Table Expressions (CTE) in SQL for aggregating data?
154,How do I ensure that my SQL query returns results ordered by a calculated field?
155,How do you handle date filtering when generating reports in SQL?
155,What are the common aggregate functions used in SQL for summarizing data?
155,Can you explain the importance of using JOIN operations in SQL queries?
155,What is the significance of the GROUP BY clause in SQL aggregate queries?
155,How would you modify the query to calculate sales data for a specific salesperson only?
156,How can I list the top-selling products in different regions using SQL?
156,What SQL functions are useful for ranking data in a query?
156,Can you explain how to use window functions to filter data in SQL?
156,What is the purpose of a Common Table Expression (CTE) in SQL queries?
156,How do joins work in SQL when combining data from multiple tables?
157,How can I write a query to calculate total sales per sales person from the sales table?
157,What SQL function can be used to check if sales targets are met based on total sales?
157,Can you explain the use of the JOIN clause in this context?
157,What would the SQL query look like if I wanted to include additional details about each sales person?
157,How do I structure a SQL query that combines aggregation with conditional logic?
158,How can I write a query to display all departments and their respective employee counts, ensuring departments with zero employees are included?
158,What is the purpose of using a LEFT JOIN in SQL queries when dealing with multiple tables?
158,Can you explain how the COUNT function works in conjunction with GROUP BY in SQL?
158,What are common mistakes to avoid when writing SQL queries involving joins and aggregate functions?
158,How can I modify a SQL query to sort the results by the number of employees instead of the department name?
159,How do you use a Common Table Expression (CTE) in a SQL query?
159,What types of joins can be used to combine data from multiple tables in SQL?
159,Can you explain aggregate functions and how they work in SQL?
159,What strategies can one use to filter results based on specific criteria in SQL?
159,How can you efficiently analyze sales data over time using SQL?
160,How do I use window functions to rank records in SQL queries?
160,What is the purpose of using CTEs (Common Table Expressions) in SQL?
160,Can you explain how to calculate aggregates for different groups in SQL?
160,What are some common mistakes to avoid when writing complex SQL queries?
160,How can I effectively join multiple tables in an SQL query to retrieve specific data?
161,How do I write a SQL query to calculate the average salary per department from multiple tables?
161,What are the differences between `HAVING` and `WHERE` clauses in SQL?
161,Can you explain how to use aggregate functions in conjunction with `JOIN` statements?
161,What would be the effect of using a different sorting order in the query results?
161,In what scenarios should I consider filtering with `HAVING` instead of `WHERE` when working with aggregates?
162,How do I write a query that calculates averages and handles missing values in SQL?
162,What is the purpose of using a LEFT JOIN in SQL queries?
162,How can I ensure that all entries from one table are included in the results, even if there are no matches in the other table?
162,What SQL function can I use to calculate averages and how is it applied in GROUP BY statements?
162,Can you explain how the GROUP BY clause works in conjunction with aggregate functions like AVG in SQL?
163,What are some common pitfalls when using GROUP BY in SQL queries?
163,How can I efficiently calculate averages in SQL without common mistakes?
163,Can you explain the purpose of a Common Table Expression in SQL queries?
163,What strategies can be used to ensure filter criteria in SQL are applied correctly?
163,How do you sort query results in SQL, and what are best practices for doing so?
164,How can I retrieve sales data filtered by date and category using SQL?
164,What SQL functions can I use to calculate total sales amounts from joined tables?
164,Can you explain the purpose of the HAVING clause in the context of this query?
164,What are common errors to avoid when using aggregate functions in SQL queries?
164,How do I implement a subquery to filter results based on aggregated data in SQL?
165,How can I retrieve the top-earner from each department using SQL?
165,What is the purpose of the ROW_NUMBER function in the context of ranking employees?
165,Can you explain how to use a Common Table Expression (CTE) in SQL for this query?
165,What are some common pitfalls when joining multiple tables in SQL?
165,How does the PARTITION BY clause affect the results when ranking data in SQL?
166,How do you write a query to calculate average values from joined tables?
166,What SQL functions are commonly used to perform aggregate calculations?
166,How can you sort the results of a SQL query based on a calculated field?
166,What is the importance of using GROUP BY in an aggregate function query?
166,Can you explain how to join two tables in SQL and the significance of the ON clause?
167,How can I use CTEs to filter records based on a date range in SQL?
167,What SQL syntax is used to aggregate data and perform sorting in a query?
167,Can you explain the process of joining multiple tables to perform calculations in SQL?
167,What are some common errors when calculating totals for groups in SQL queries?
167,How can I modify the query to include additional customer information in the results?
168,What SQL techniques can be used to summarize sales data over a specific period?
168,How does JOIN work in SQL, and how is it applied in the context of sales and products?
168,Can you explain the use of Common Table Expressions (CTEs) for organizing complex SQL queries?
168,What are the considerations for date filtering when analyzing time-series sales data?
168,How can I modify the query to include other metrics such as average sales per product per month?
169,How can I write a query to find customers who spent the most in a specific time frame?
169,What techniques are used to calculate aggregate values in SQL?
169,Can you explain how to use Common Table Expressions (CTEs) in SQL for data analysis?
169,What SQL functions are useful for date comparisons in queries?
169,How do you handle NULL values when calculating totals in SQL?
170,How can I write a SQL query to find the top customers based on total spending over a specific timeframe?
170,What is the purpose of using a Common Table Expression (CTE) in SQL queries?
170,Can you explain how to join two tables in SQL and why it's necessary in this example?
170,What SQL functions can be used to aggregate data, such as total sales, and how do they work?
170,How do you limit the number of results returned by a SQL query, and what are some common methods to do this?
171,What is the purpose of using the HAVING clause in this SQL query?
171,How would you modify the query to include customers with exactly 5 orders instead of more than 5?
171,Can you explain the difference between JOIN and GROUP BY in SQL?
171,What other aggregate functions could be useful in this scenario besides COUNT and SUM?
171,How can you optimize this query for performance if the tables have a large number of records?
172,How can I improve the performance of my SQL queries when dealing with large sales datasets?
172,What are the differences between ROW_NUMBER(), RANK(), and DENSE_RANK() in SQL?
172,Can you explain the use of Common Table Expressions (CTEs) in SQL and their advantages?
172,What strategies can be employed to handle ties in sales when determining top products?
172,How would I modify the query to include additional product information, such as product names or categories?
173,How do you perform a join between two tables in SQL?
173,What is the purpose of the HAVING clause in SQL queries?
173,Can you explain how to calculate the average using aggregate functions in SQL?
173,How do you filter results based on aggregate values in SQL?
173,What is the significance of ordering results in a SQL query?
174,What is the purpose of using LEFT JOIN in SQL queries?
174,How can I ensure departments with no employees still appear in my SQL results?
174,What SQL function is used to calculate the average salary in a dataset?
174,How does grouping work in SQL, and why is it important for this query?
174,What are common pitfalls when handling NULL values in SQL aggregate functions?
175,What is the purpose of using a LEFT JOIN in the provided SQL query?
175,How does the COALESCE function work in this context?
175,Can you explain the significance of grouping by customer name in the SQL query?
175,What would the output look like if there are customers with no orders?
175,How can I modify the query to include additional customer details such as country?
176,How can I calculate the total salary for each department in SQL?
176,What SQL syntax is used to filter groups based on aggregate values?
176,Can you explain the purpose of the HAVING clause in SQL queries?
176,What type of JOIN is used when combining data from multiple tables in SQL?
176,How would you modify the query to include departments with a total salary under $250,000?
177,How can I write a SQL query to calculate sales totals by category over a specified time period?
177,What are the advantages of using JOIN operations in SQL queries?
177,How does the DATEADD function work in filtering data by date ranges?
177,What is the purpose of the GROUP BY clause in SQL, particularly in aggregate functions?
177,How can I optimize a SQL query that aggregates data from large tables?
178,How do you create a Common Table Expression (CTE) in SQL?
178,What is the purpose of the RANK() function in SQL?
178,Can you explain how to join two tables in SQL?
178,What are the implications of using the HAVING clause instead of the WHERE clause?
178,How would you modify the query to include customers with exactly $500 in sales?
179,What SQL functions are commonly used to calculate totals in a dataset?
179,How can I optimize a SQL query that retrieves aggregate data from multiple tables?
179,What are some frequent errors when joining tables in SQL, and how can I avoid them?
179,Can you explain the importance of the GROUP BY clause in SQL queries involving aggregates?
179,What strategies can be applied to efficiently limit results in a SQL query?
180,How do you perform aggregations using SQL queries with multiple tables?
180,What is the significance of using GROUP BY in SQL, and how does it relate to aggregate functions?
180,Can you explain the process of joining two tables in SQL and provide an example?
180,What are the differences between INNER JOIN and other types of joins in SQL?
180,How can you filter results based on specific criteria in SQL after performing a join?
181,How can I join two tables in SQL to analyze data related to employees and departments?
181,What SQL query can I use to calculate the average salary from a table?
181,How do I group query results by a specific column in SQL?
181,What is the purpose of the ORDER BY clause in SQL and how is it used here?
181,Can you explain how aggregate functions work in SQL with an example?
182,How do I perform a LEFT JOIN in SQL, and why is it useful in this scenario?
182,What is the purpose of using the COUNT function in an aggregate query?
182,Can you explain how to group results in SQL and why it's necessary for this query?
182,What are common mistakes to avoid when counting records in a SQL query?
182,How can I modify the query to also retrieve the department ID along with the department name and employee count?
183,How can I write a SQL query to find the lowest salary in each department along with employee names?
183,What are some common mistakes to avoid when using window functions in SQL?
183,Can you explain how the ROW_NUMBER() function works in SQL with an example?
183,What techniques can be used to optimize the performance of SQL queries that involve joins and window functions?
183,How do I modify a query to include employees who have the same highest salary in a department?
184,What is the purpose of using a CTE in SQL queries?
184,How can I filter results based on aggregate functions in SQL?
184,What is the difference between joining tables and using subqueries?
184,How do you calculate averages for grouped data in SQL?
184,What SQL functions are commonly used for analyzing employee data in organizations?
185,How can I perform a left join in SQL to include all records from one table while filtering from another?
185,What is the purpose of the COALESCE function in SQL and how is it used in aggregate queries?
185,Can you explain how to use GROUP BY in combination with aggregate functions like SUM in SQL?
185,What are some common SQL mistakes to avoid when writing queries that include joins and aggregates?
185,How would you modify the provided query to include additional product details such as category_id from the products table?
186,What are the advantages of using Common Table Expressions (CTEs) in SQL queries?
186,Can you explain the role of the JOIN operation in combining data from multiple tables?
186,How do you ensure that your query only includes customers with sales records?
186,What SQL functions would you use to calculate totals and minimum values in a dataset?
186,How can you modify the output of this query to include additional customer details?
187,How do I write a query to find average sales per customer in a specific region?
187,What are common mistakes to avoid when using JOINs in SQL queries?
187,Can you explain the difference between GROUP BY and ORDER BY in SQL?
187,What is the purpose of the HAVING clause in SQL and how is it different from WHERE?
187,How can I modify the query to include customers with total sales less than $500?
