id,question
251,What is the purpose of using a Common Table Expression (CTE) in this query?
251,Could you explain how the DATEADD function works in filtering orders by date?
251,What other aggregate functions could be useful in analyzing customer order data?
251,How can I adapt this query to include customer details such as location or contact info from another table?
252,What SQL functions are commonly used to calculate averages in queries?
252,How do you join two tables in SQL and what are some common pitfalls?
252,Can you explain how to group results in SQL and provide examples?
252,What is the significance of using ORDER BY in SQL queries and how does LIMIT work?
252,What techniques can be used to find the top record in a query result set?
253,How do I aggregate data from multiple tables in SQL?
253,What is the purpose of using JOIN in SQL queries?
253,Can you explain the significance of GROUP BY in SQL?
253,How can I order query results based on calculated values like averages?
253,What are some common mistakes to avoid when writing SQL aggregate queries?
254,How can I write a query to find the department with the lowest average employee salary?
254,What SQL functions can I use to round numbers in my queries?
254,Can you explain how to join multiple tables in a query and what common mistakes to avoid?
254,What are the implications of using GROUP BY in aggregate queries?
254,How do I optimize a query for performance when dealing with joins across multiple tables?
255,What steps should I take to find the average salary per department in SQL?
255,How can I filter results to show only departments with a minimum number of employees?
255,What is the purpose of using the HAVING clause in an SQL query?
255,Can you explain the difference between INNER JOIN and other types of JOINs in SQL?
255,How do aggregate functions like AVG work in SQL queries?
256,What query would I use to find the average salary of all employees within each department?
256,How can I modify the provided SQL query to return the lowest salary instead of the highest per department?
256,Can you explain how the JOIN operation works in the context of retrieving data from multiple tables?
256,What other aggregate functions can be used in SQL, and how can they be applied to the `employees` table?
256,How can I write a SQL query to display the number of employees in each department along with their department names?
257,How can I write a SQL query to calculate the total sales for customers based on their join year?
257,What SQL techniques can be used to aggregate data across multiple tables?
257,Can you explain the use of Common Table Expressions (CTE) in SQL queries?
257,What is the significance of using the SUM function in SQL aggregation queries?
257,How do I sort query results by a calculated aggregate value in SQL?
258,What SQL functions can be used to calculate total sales from multiple rows in a query?
258,How do JOIN operations affect the results when combining data from two tables?
258,What steps should be taken to filter results based on specific conditions in SQL?
258,Can you explain the significance of the GROUP BY clause in SQL and how it is used?
258,What are common pitfalls to avoid when writing SQL queries involving aggregation and sorting?
259,How can I use Common Table Expressions (CTEs) in SQL queries?
259,What is the purpose of using JOIN in SQL?
259,How do aggregate functions like AVG work in SQL?
259,Can you explain how to find maximum values from a grouped result set?
259,What are some common mistakes to avoid when writing SQL queries involving multiple tables?
260,What is a Common Table Expression (CTE) and how is it used in SQL queries?
260,How can I calculate total sales revenue from multiple tables in SQL?
260,What SQL functions can be used to aggregate data and analyze revenue over a specified year?
260,Can you explain the process of joining tables in SQL and its importance in data analysis?
260,What are some common mistakes to avoid when writing SQL queries for revenue calculations?
261,What is the purpose of joining the 'employees' and 'departments' tables in the provided SQL query?
261,How does the SQL query calculate the average salary for each department?
261,What SQL clause is used to sort the results by average salary, and how does it function?
261,In the context of SQL, what is the significance of the GROUP BY clause in the given query?
261,Can you explain how to modify the query to filter by a specific department's average salary?
262,How can I modify the query to find the top 5 customers instead of the top 3?
262,What SQL functions are used to handle date calculations in this query?
262,Could you explain the role of the Common Table Expression (CTE) in this solution?
262,What might be the consequences of not including the WHERE clause in the SQL query?
262,How can I adapt this query to find top customers based on quantity of orders instead of total spending?
263,How can I write a SQL query to join two tables and handle null values?
263,What is the purpose of using COALESCE in SQL aggregate functions?
263,Can you explain the difference between INNER JOIN and LEFT JOIN in SQL?
263,How do I ensure that all rows from one table are included in the result when performing a join?
263,What are some common mistakes to avoid when writing aggregate SQL queries?
264,How can I identify employees in a table who are not managing anyone?
264,What SQL techniques can I use to join multiple tables to retrieve specific data?
264,In an SQL query, how do I handle cases where an employee may not have a corresponding entry in another table?
264,What is the purpose of using LEFT JOIN when querying data from multiple tables?
264,Can you explain how to filter results in SQL to find records with NULL values in a specified column?
265,How do you use window functions in SQL to rank data within groups?
265,What are some common pitfalls when joining multiple tables in SQL?
265,Can you explain the purpose of Common Table Expressions (CTEs) in SQL queries?
265,How can you modify the given query to find the second highest-paid employee in each department?
265,What performance considerations should you keep in mind when using the ROW_NUMBER() function in large datasets?
266,How can I optimize a SQL query involving multiple joins for efficiency?
266,What are the best practices for filtering and aggregating data in SQL?
266,Can you explain the use of the HAVING clause in aggregate functions?
266,What is the difference between INNER JOIN and LEFT JOIN in SQL queries?
266,How do I approach writing complex SQL queries for analytics tasks?
267,How do you calculate the average salary for employees grouped by department in SQL?
267,What is the purpose of using a Common Table Expression (CTE) in SQL queries?
267,Can you explain how to filter groups based on having more than a certain number of records in SQL?
267,What are the requirements for using JOIN clauses effectively in SQL?
267,How would you modify the query to include additional employee details while calculating the average salary?
268,How can I calculate the total salary of employees in each department while applying a filter based on department names?
268,What is the purpose of the HAVING clause in aggregate queries like the one calculating average salaries?
268,Can I modify the query to include only departments with more than five employees when calculating the average salary?
268,What are some common mistakes to avoid when using JOINs and GROUP BY in SQL queries?
268,How would the query change if I wanted to find the maximum salary in each department instead of the average salary?
269,How do you calculate total revenue from multiple tables in SQL?
269,What SQL functions can be used to handle potential division by zero errors?
269,Can you explain the purpose of using JOIN in SQL queries?
269,What is the significance of grouping data in SQL, and how does it affect the results?
269,How can you ensure that your SQL query returns results sorted by a specific column?
270,What is the difference between INNER JOIN and LEFT JOIN when aggregating data?
270,How do you ensure that all departments are listed in the results, even if they have no employees?
270,Can you explain how the COUNT() function works in SQL and its behavior in LEFT JOIN scenarios?
270,What common errors do SQL candidates make related to GROUP BY clauses?
270,How would you modify the query to include additional columns from the employees table, if needed?
271,How can I calculate the average salary for employees grouped by their departments using SQL?
271,What SQL functions are used to aggregate data in a query?
271,What is the purpose of using JOIN in a SQL query with multiple tables?
271,Can you explain the importance of the GROUP BY clause in SQL?
271,What sort of errors might I encounter when writing SQL queries that involve aggregates and joins?
272,What are best practices for writing JOIN queries in SQL?
272,How do aggregate functions work in SQL, and can you provide examples?
272,Can you explain the difference between the HAVING and WHERE clauses in SQL?
272,What common errors should I watch out for when using GROUP BY in SQL queries?
272,How can I optimize SQL queries that involve multiple joins and aggregations?
273,How do you write a query to count employees in different departments using SQL?
273,What is a Common Table Expression (CTE) and how is it used in SQL queries?
273,How can you handle ties in the results of an SQL query when multiple departments have the same employee count?
273,Can you explain the LEFT JOIN operation and its significance in this query?
273,What aggregate functions can be used in SQL to summarize data from tables?
274,How do you use Common Table Expressions to simplify complex SQL queries?
274,Can you explain the difference between ROW_NUMBER() and RANK() in SQL?
274,What are some common pitfalls to avoid when joining multiple tables in SQL?
274,How can you retrieve the most recent record for each employee from a dataset?
274,What is the purpose of the PARTITION BY clause in window functions, and how is it used?
275,What SQL clause should I use to filter aggregated results after grouping?
275,How do I join two tables in SQL based on a common column?
275,What is the purpose of the `HAVING` clause in SQL?
275,How can I count the number of entries for each group in SQL?
275,What is the significance of filtering data by date in an SQL query?
276,What is the purpose of using a LEFT JOIN in SQL queries?
276,How can COALESCE be useful in handling NULL values in SQL results?
276,What aggregation function would you use to calculate total spending in a SQL query?
276,Can you explain how to group results in SQL and why it's important?
276,What are the implications of including customers with no purchases in a sales report?
277,How do I perform a LEFT JOIN in SQL to include records with no matches?
277,What is the purpose of using COALESCE in SQL queries, and how does it work?
277,Can you explain the importance of GROUP BY in aggregating data in SQL?
277,What SQL functions can be used to handle NULL values in aggregations?
277,How can I modify a query to include additional customer information from related tables?
278,How can I include departments with no employees in my SQL query?
278,What is the purpose of using a LEFT JOIN in this context?
278,How does the COUNT function work when counting employees in each department?
278,What happens if I use an INNER JOIN instead of a LEFT JOIN in this scenario?
278,Can you explain the importance of the GROUP BY clause in aggregate queries?
279,How do I write an SQL query to calculate total sales for each product over a specified time period?
279,What are the best practices for using Common Table Expressions (CTEs) in SQL queries?
279,Can you explain how to join multiple tables in SQL when working with sales data?
279,What are common mistakes to avoid when writing aggregate functions in SQL?
279,How can I optimize an SQL query that retrieves the top N records based on a computed value?
280,What SQL techniques can be applied to identify top customers based on their spending habits?
280,How can I use a Common Table Expression (CTE) to simplify complex queries in SQL?
280,What are some common errors to avoid when writing aggregate queries in SQL?
280,Can you explain the role of JOINs in SQL and how they affect query results with multiple tables?
280,What strategies can I use to optimize SQL queries that involve large datasets?
281,How can I calculate the average salary for each department using SQL?
281,What SQL query would I use to join two tables based on a common column?
281,What is the significance of the GROUP BY clause in SQL queries?
281,How do I order results in an SQL query to find the top entry?
281,What are some common mistakes to avoid when writing SQL queries for aggregation?
282,How can I write a query to calculate the total spending of customers based on their orders?
282,What SQL clause is used to filter groups based on an aggregate function?
282,How do I sort the results of a SQL query in descending order?
282,What is the purpose of the JOIN operation in the provided SQL query?
282,Can you explain how the GROUP BY clause works in this context?
283,What are some common pitfalls when writing SQL queries that involve joins and aggregations?
283,How do I efficiently retrieve the top N records from a SQL query?
283,What is the importance of grouping in SQL, and how does it affect the results?
283,Can you explain the difference between inner joins and outer joins in SQL?
283,What strategies can I use to optimize SQL queries for performance?
284,How do you perform a join operation in SQL to combine data from multiple tables?
284,What is the purpose of using the HAVING clause in SQL, and how does it differ from WHERE?
284,Can you explain the significance of GROUP BY in SQL queries?
284,What are some common pitfalls when aggregating data in SQL?
284,How can you modify the given query to include managers with zero sales?
285,What is the purpose of using a LEFT JOIN in the provided SQL query?
285,How can I modify the query to include employees hired before 2020?
285,Can you explain the use of GROUP BY in this SQL query?
285,What are the implications of excluding employees with no reviews from the results?
285,How would the query change if I wanted to filter by a specific rating threshold?
286,What SQL constructs are essential for calculating averages from multiple tables?
286,How can I filter aggregated results based on specific criteria in SQL?
286,Can you explain the purpose of using a Common Table Expression (CTE) in SQL queries?
286,What is the significance of using JOIN operations when working with related tables in SQL?
286,Are there any common pitfalls to avoid when writing SQL queries that involve aggregate functions?
287,What is the purpose of using the HAVING clause in SQL queries?
287,How do you ensure that only departments with an average salary above a certain threshold are included in the results?
287,Can you explain how to properly use JOINs in SQL to combine data from multiple tables?
287,What are some common pitfalls when calculating average values in SQL with aggregate functions?
287,Why is it important to sort query results, and how do you do it effectively in SQL?
288,How do you calculate the average of a column in SQL using aggregate functions?
288,What is the purpose of the GROUP BY clause in SQL queries?
288,Can you explain the use of JOIN in combining data from two tables?
288,How do you order query results based on an aggregated value in SQL?
288,What are common mistakes to avoid when writing SQL queries involving aggregation and grouping?
289,What SQL techniques can I use to analyze sales data across different categories?
289,How can I filter records based on specific date ranges in SQL?
289,What is the purpose of using the JOIN clause in a SQL query?
289,Can you explain how to group and aggregate data in SQL?
289,What are some common mistakes to avoid when writing SQL queries for data analysis?
290,How can I calculate total revenue from a specific date range in SQL?
290,What is a Common Table Expression (CTE) and how is it used in SQL queries?
290,How do I format date outputs in SQL to show month names?
290,What are some common errors when performing joins in SQL?
290,Can you explain how to aggregate data using SQL functions?
291,How can I use SQL to aggregate data from multiple tables?
291,What are the steps to filter results in a SQL query using the HAVING clause?
291,Can you explain the difference between INNER JOIN and other types of joins in SQL?
291,How would you modify a SQL query to include additional product details in the results?
291,What are common performance considerations when aggregating large datasets in SQL?
292,How do I calculate sales for specific categories over a defined time period in SQL?
292,What is the purpose of using JOIN in SQL to combine data from multiple tables?
292,Can you explain how to filter records based on dates in SQL?
292,What are the steps to aggregate data in SQL and provide summaries for different groups?
292,How can I sort query results in descending order based on an aggregate value in SQL?
293,What SQL functions are commonly used to calculate averages from a set of values?
293,How do joins work in SQL, and what types are available?
293,Can you explain grouping data with the GROUP BY clause?
293,Why is it important to sort query results, and how is it achieved in SQL?
293,What are some common mistakes to avoid when writing SQL queries involving multiple tables?
294,How can I create a SQL query to calculate total sales per employee for specific criteria?
294,What is a Common Table Expression (CTE) and how is it used in SQL queries?
294,Can you explain how the ROW_NUMBER() function works in the context of ranking data?
294,What are some common mistakes to avoid when writing SQL queries for aggregating data?
294,How do I modify the SQL query to find the top N employees by sales amount instead of just the top 3?
295,How do you write a query to aggregate data across multiple tables in SQL?
295,What is the purpose of using JOIN in SQL queries?
295,Can you explain how to filter records by date in SQL?
295,What methods can be used to group and summarize data in SQL?
295,How do you sort query results by a specific column in SQL?
296,What SQL functions can be used to calculate the total spending of customers in a database?
296,How do you effectively join two tables in SQL for this kind of analysis?
296,What would be the impact of not using the HAVING clause in this query?
296,Can you explain the importance of data filters when analyzing customer behavior in SQL?
296,What are some common best practices to follow when writing complex SQL queries with joins and aggregations?
297,What SQL functions are used to calculate total spending across multiple tables?
297,How can I modify the query to find the top customers over a different time period?
297,What is the purpose of using a Common Table Expression (CTE) in this SQL query?
297,Can you explain how the JOIN operations work in this query?
297,What tips can help me avoid common mistakes when writing aggregate queries in SQL?
298,What is the purpose of using the JOIN clause in SQL, and how does it apply to the provided query?
298,How can you modify the query to include the total number of employees in each department along with the average salary?
298,What are common pitfalls to avoid when grouping data in SQL, as evidenced by the example given?
298,How would you rewrite the query if you also wanted to filter out departments with an average salary below a certain threshold?
298,Can you explain the role of the GROUP BY clause in the context of aggregating data in SQL queries?
299,What is the significance of using a LEFT JOIN in SQL queries?
299,How can I modify a SQL query to filter results based on specific criteria while still including departments with no employees?
299,What are the differences between COUNT and COUNT(*) functions in SQL?
299,Can you explain how GROUP BY works in the context of SQL queries?
299,What strategies can I use to optimize SQL queries that involve JOINs?
300,How can I write a SQL query to summarize data from multiple tables?
300,What is the purpose of the JOIN clause in SQL?
300,How do I filter results based on aggregate functions in SQL?
300,What strategies can I use to identify customers with a high order volume using SQL?
300,Can you explain how GROUP BY and HAVING work together in SQL queries?
301,How do you use LEFT JOIN to include all records from one table and matching records from another in SQL?
301,What is the purpose of the COALESCE function in SQL, and how is it used in the context of handling NULL values?
301,Can you explain the process of calculating an average value using SQL aggregation functions?
301,What will happen in the query if there are departments with no employees, and how does the SQL handle this situation?
301,Could you give an example of how GROUP BY works in SQL along with a JOIN operation?
302,What is the purpose of using a LEFT JOIN in SQL queries?
302,How can I include departments with no employees in my aggregate calculations?
302,What is the function of COALESCE in SQL and how is it used in this query?
302,Can you explain the importance of grouping when calculating averages in SQL?
302,How do you sort query results by an aggregated value in SQL?
303,How can I calculate the total sales and the number of items sold for each category in SQL?
303,What SQL clause is used to group results by a specific attribute?
303,In SQL, how do you filter records by a date range?
303,What type of SQL join is utilized to combine data from two tables based on a common column?
303,What aggregate functions can be used to summarize data in SQL queries?
304,How can I write a query to filter customers based on their order history and join with customer details?
304,What are the best practices to use Common Table Expressions in queries like this one?
304,Can you explain how to handle conditions in the HAVING clause when counting orders?
304,What are common mistakes to avoid when joining multiple tables in an SQL query?
304,How should I structure a query to sort results based on aggregated values in SQL?
305,What SQL functions are commonly used for aggregating sales data in a query?
305,How do you calculate the total sales for specific products over a certain time period using SQL?
305,What are the best practices for joining multiple tables in SQL queries?
305,Can you explain how to sort query results based on aggregated values?
305,What would be the impact of using different date functions in SQL when filtering sales data?
306,How do I perform joins in SQL and what are common types of joins?
306,What are aggregate functions in SQL and how are they used?
306,Can you explain the GROUP BY clause and its significance in SQL queries?
306,How can I sort the results of a query in SQL and what keywords are used?
306,What factors should I consider when calculating revenue in a SQL query?
307,How can I retrieve the highest-paid employee from each department using SQL?
307,What is the purpose of the ROW_NUMBER() function in SQL queries?
307,Can you explain the use of Common Table Expressions (CTEs) in SQL?
307,What SQL modifications are needed to return the top N paid employees instead of just the top 3?
307,How can I handle cases where two employees have the same salary when ranking them?
308,How do you write a SQL query to filter records based on a date range?
308,What are the common mistakes to avoid when calculating totals in SQL?
308,Can you explain the purpose of using a Common Table Expression (CTE) in SQL?
308,How do you perform a join between two tables while applying specific filters?
308,What SQL functions would you use to manipulate date and time data effectively?
309,What SQL construct can be used to include departments with no employees in the average salary calculation?
309,How can I modify a SQL query to extract data for a specific year?
309,What is the purpose of the COALESCE function in SQL, and how is it used in this example?
309,Can you explain the difference between INNER JOIN and LEFT JOIN in SQL with context to the provided query?
309,What are common techniques to aggregate data across multiple tables in SQL?
310,What is the purpose of using the JOIN clause in SQL queries?
310,How can I effectively filter records based on date ranges in SQL?
310,What are common mistakes to avoid when writing GROUP BY queries?
310,Can you explain the significance of aggregate functions in SQL?
310,What approaches can be used to analyze sales data across different time periods in SQL?
311,What type of SQL join is used in the provided query, and why is it necessary?
311,How does the 'HAVING' clause function in this context, and how is it different from 'WHERE'?
311,What will be the result if no departments have a total salary expense over $100,000?
311,Can you explain how the 'SUM' function operates in this SQL query?
311,What potential issues might arise if there are departments with no employees when executing this query?
312,How can I modify the query to find the top 5 products instead of the top 3?
312,What are some common mistakes to avoid when writing SQL queries that involve joins and aggregations?
312,Can you explain the purpose of using a Common Table Expression (CTE) in SQL?
312,What SQL functions would I use to calculate total sales and distinct customer counts in a different context?
312,How do I optimize a SQL query to improve its performance for large datasets?
313,How can I write a SQL query to find the top-selling products over a specific time period?
313,What are some common mistakes to avoid when using aggregate functions in SQL?
313,Can you explain how to use Common Table Expressions (CTE) in a SQL query?
313,What is the best way to join two tables in SQL based on a common column?
