id,question
437,How can I modify the query to sort the results by average salary in descending order?
438,What is the purpose of using the RANK() function in a SQL query?
438,How can I modify the query to include additional customer details like their names?
438,What would happen if two customers had the same total sales in this ranking system?
438,Can you explain the role of Common Table Expressions (CTEs) in organizing complex SQL queries?
438,How do I sort the results based on other criteria aside from total sales amount?
439,How can I modify the query to show the total number of employees earning more than $50,000 in each department?
439,What changes are needed to include department names in addition to the department IDs in the query results?
439,Can you explain how the JOIN operation is used in this SQL query?
439,How would the query differ if I wanted to find departments with no employees earning more than $50,000?
439,What are common mistakes to avoid when writing similar SQL queries involving multiple tables?
440,How can I calculate the average salary of employees by department using SQL?
440,What is the significance of using LEFT JOIN in the provided SQL query?
440,How do I filter out departments without employees in an SQL query?
440,What SQL functions are used to aggregate data in the given question?
440,Can you explain how to group results in SQL and why it's necessary for this query?
441,What is the purpose of using a JOIN clause in SQL queries?
441,How do I aggregate data from multiple tables in a single SQL query?
441,What is the significance of the GROUP BY clause in SQL, and when should it be used?
441,Can you explain how to filter records based on certain conditions in a SQL query?
441,What are some common mistakes to avoid when writing SQL queries for data aggregation?
442,How do you write a SQL query to calculate total sales for each product within a specific year?
442,What is the purpose of using JOIN in the provided SQL query?
442,Can you explain how the GROUP BY clause functions in the context of this query?
442,How would you modify the query to include products that were not sold in 2023?
442,What are some common errors to avoid when writing aggregate queries in SQL?
443,How do you calculate the total spending of customers over a specific time frame using SQL?
443,What SQL function can be used to limit the number of results returned in a query?
443,Can you explain how a Common Table Expression (CTE) works in SQL?
443,What would be the impact of changing the time frame from one year to six months in the provided query?
443,What are some common mistakes to avoid when writing aggregate queries in SQL?
444,How do you write a query to calculate the total sales per manager while ensuring only managers with direct reports are included?
444,Can you explain the purpose of joining the 'employees' table with itself in the given SQL query?
444,What SQL functions are used in the provided query to perform aggregation and group data?
444,What would happen if the HAVING clause was removed from the query?
444,How can this query be modified to include managers without direct reports and display a total of zero for their sales?
445,What SQL functions can I use to aggregate data and generate summaries in queries?
445,How do I properly join multiple tables in SQL to retrieve related data?
445,What are the best practices for using the GROUP BY clause in SQL queries?
445,Can you explain the importance of using the ORDER BY clause in aggregate queries?
445,What common errors should I avoid when writing SQL queries to analyze sales data?
446,What SQL clauses are used to aggregate data from multiple tables in this query?
446,How can I modify the query to include customers who haven't made any purchases?
446,What is the purpose of using a Common Table Expression (CTE) in this scenario?
446,How can I format the output date to a specific format in the final result set?
446,Can you explain how the JOIN operation is utilized in this SQL query?
447,How do I write a query to aggregate sales data from multiple tables?
447,What is a Common Table Expression (CTE) and how is it used in SQL?
447,Can you explain how to filter results by a specific date range in SQL?
447,How do you join two tables in SQL and what types of joins are available?
447,What considerations should I keep in mind when grouping data for aggregation in SQL?
448,How do I calculate total sales revenue for a specific month using SQL?
448,What is the purpose of using a Common Table Expression (CTE) in SQL queries?
448,Can you explain how to join multiple tables and apply aggregate functions?
448,What are common pitfalls when writing SQL queries for summing revenue?
448,How can I sort results in descending order based on aggregated values in SQL?
449,How can I use SQL to create a summary report of employee hours on projects including manager details?
449,What SQL techniques can be applied to ensure inclusion of employees with no project hours in the output?
449,Can you explain the use of Common Table Expressions (CTEs) in breaking down complex queries for reporting?
449,What are the differences between LEFT JOIN and INNER JOIN in the context of this employee and project query?
449,How can aggregate functions like SUM be effectively utilized in SQL to analyze employee performance on projects?
450,What is the purpose of using JOIN in SQL queries?
450,How do you calculate the average of a numeric column in SQL?
450,What steps should be taken to correctly group results when using aggregate functions?
450,Can you explain the significance of ordering results in SQL queries?
450,What are some frequent errors made when writing queries that involve multiple tables?
451,How do I write a SQL query to calculate the average spending of customers over a specific period?
451,What common mistakes should I avoid when using JOINs in SQL for aggregating data?
451,Can you explain how to use Common Table Expressions in SQL for summarizing data from multiple tables?
451,What are the best practices for filtering data in SQL queries to ensure accurate results?
451,How can I modify the provided SQL query to include only customers who have made more than five orders in the last year?
452,What SQL statement would I use to retrieve sales data for a specific year from multiple tables?
452,How can I calculate total revenue from a database that includes product and sales information?
452,What is the significance of using JOIN in SQL queries, especially when working with related tables?
452,How do I filter records in SQL based on a particular date or year?
452,What strategies can I employ to sort query results by calculated values in descending order?
453,What is the purpose of using the JOIN clause in the SQL query?
453,How can I modify the query to include departments with an average salary less than 50,000?
453,What would happen if I omitted the GROUP BY clause in this query?
453,Can you explain how the HAVING clause works in this context?
453,What are the implications of using AVG() as an aggregate function in SQL queries?
454,How do I calculate total sales revenue for a specific time period using SQL?
454,What is the purpose of using a Common Table Expression (CTE) in SQL queries?
454,Can you explain how to filter results based on aggregated values in SQL?
454,What are the best practices for joining multiple tables in SQL?
454,How do I sort results in descending order based on an aggregate function in SQL?
455,How can I modify the query to also show the number of sales transactions for each manager?
455,What is the purpose of using COALESCE in the SQL query provided?
455,Can you explain the difference between LEFT JOIN and INNER JOIN in the context of this query?
455,What would happen if I removed the condition 'WHERE e.manager_id IS NULL' from the query?
455,How can I extend this query to filter by a specific date range for the sales records?
456,How can I modify the query to find the top 5 highest-paid employees instead of the top 3?
456,What is the importance of the PARTITION BY clause in the ROW_NUMBER function when ranking employees?
456,Can you explain the significance of using a Common Table Expression (CTE) in this SQL query?
456,What would happen if the ORDER BY clause was omitted from the ROW_NUMBER function in this scenario?
456,How do I ensure my SQL query retrieves the correct department names along with employee salaries?
457,What SQL functions are used to calculate averages in queries?
457,How can you filter grouped results in SQL?
457,What is the purpose of the HAVING clause in an SQL query?
457,Can you explain the importance of sorting results in SQL outputs?
457,What common errors should be avoided when joining multiple tables in SQL?
458,What SQL techniques are essential for calculating total revenue from sales data?
458,How do you effectively use Common Table Expressions (CTEs) in SQL queries?
458,What are common mistakes to avoid when joining multiple tables in SQL?
458,How can you filter data for a specific time frame in an SQL query?
458,What is the importance of ordering results in SQL, and how is it implemented?
459,How can I create a query to determine the total sales of customers who joined after a specific date?
459,What are the best practices for using JOINs in SQL queries involving multiple tables?
459,Can you explain how to use aggregate functions to analyze customer spending data?
459,What common mistakes should I avoid when grouping data in SQL queries?
459,How do I limit the result set to the top entries based on an aggregate calculation?
460,How do I write a SQL query to filter data based on specific regions?
460,What is the purpose of using JOIN in SQL queries?
460,Can you explain how to use aggregate functions like SUM in SQL?
460,What considerations should I keep in mind when filtering by date in SQL?
460,How do I group results in SQL to summarize data effectively?
461,How do you create a SQL query to join two tables while calculating a specific metric?
461,What functions can be used to aggregate data in SQL for financial reporting?
461,Can you explain how to filter records by a specific date range in a SQL query?
461,What are some common challenges when grouping results by multiple columns in SQL?
461,How would you modify the query to include additional filters, such as a specific product category?
462,What SQL query would you use to find customers who have made significant purchases from their order history?
462,How do you write a query that aggregates sales data for customers based on their total spending?
462,Can you explain how to use JOIN and GROUP BY in a SQL query to analyze customer sales performance?
462,What are the steps involved in filtering query results based on aggregated sales figures in SQL?
462,How do you ensure the results of a SQL query are sorted by a computed column like total sales amount?
463,How can I use SQL to find average values grouped by categories in multiple tables?
463,What are some common SQL functions used for aggregating data?
463,Can you explain the purpose of JOIN clauses in SQL queries?
463,What techniques can I use to sort query results in SQL?
463,How do I structure an SQL query to include both average calculations and groupings?
464,What is the purpose of using the HAVING clause in a SQL query?
464,How do you properly join two tables in SQL?
464,What are some common errors when calculating averages in SQL?
464,Can you explain the importance of sorting results in SQL queries?
464,How can you retrieve data from multiple tables while applying aggregate functions?
465,How can I use window functions in SQL to analyze employee salaries over time?
465,What are the best practices for using Common Table Expressions (CTEs) in SQL queries?
465,Can you explain how to retrieve the latest records from a table based on a date column?
465,What SQL techniques can I use to aggregate data from multiple tables effectively?
465,In what scenarios would I need to rank records within a SQL query?
466,What is the purpose of using INNER JOIN in SQL queries?
466,How can I modify the query to find employees of a different manager?
466,What are common mistakes to avoid when writing join statements in SQL?
466,Can you explain how to filter results based on multiple criteria in a SQL query?
466,What is the difference between INNER JOIN and LEFT JOIN in the context of this example?
467,What SQL function is used to retrieve the highest salary from the employees table?
467,How can you ensure that departments with no employees are included in the SQL result?
467,What type of JOIN is appropriate for combining these two tables to achieve the desired result?
467,What is the significance of the GROUP BY clause in the context of this query?
467,Can you explain how the LEFT JOIN affects the output of the query for departments without employees?
468,How do you perform aggregation and filtering in SQL?
468,What is the significance of using GROUP BY in SQL queries?
468,Can you explain the purpose of the HAVING clause in an SQL query?
468,How do you join two tables in SQL to get combined data?
468,What strategies can be used to optimize SQL queries involving joins and aggregations?
469,What SQL clauses are used to filter results based on a specific date in a query?
469,How do you perform a join between two tables in SQL?
469,Can you explain the purpose of the SUM function in SQL aggregate queries?
469,What is the significance of GROUP BY in SQL and how does it work with aggregate functions?
469,How can the results of an SQL query be sorted in descending order based on a calculated value?
470,What are Common Table Expressions (CTEs) and how are they used in SQL queries?
470,How can I calculate the average salary for each department in a SQL database?
470,What SQL commands would I use to find the department with the highest average salary from multiple tables?
470,Can you explain how to join multiple tables in SQL and why it's important for this query?
470,What are some common errors to avoid when writing SQL queries that involve aggregates and joins?
471,What is the purpose of using joins in SQL, and how do they work in the context of this sales and products scenario?
471,How can I modify the given query to analyze sales data for a different time frame, such as the last week?
471,What are the potential pitfalls when filtering date data in SQL, particularly when dealing with different date formats or time zones?
471,Can you explain the significance of the GROUP BY clause in this query and how it affects the results?
471,What variations of aggregate functions can be applied in similar queries to derive different insights from the sales data?
472,What core SQL concepts are applied in joining multiple tables?
472,How does the GROUP BY clause work in SQL, particularly in this context?
472,What is the importance of using aggregate functions like AVG in SQL queries?
472,How can you modify this query to include only departments with an average salary above a certain threshold?
472,What are some common pitfalls when writing SQL queries that involve joins and aggregate functions?
473,How can I write a query to find the total revenue generated by customers who registered in a specific year?
473,What SQL functions are used to aggregate data when calculating total sales for each customer?
473,Can you explain how to join multiple tables in SQL to retrieve related information?
473,What is the significance of using GROUP BY in SQL queries, especially in aggregation?
473,How would I modify the query to include customers who have made no purchases in the current year?
474,How can I efficiently join two tables in SQL to analyze employee data?
474,What SQL syntax is used to calculate the average and count of rows from joined tables?
474,Can you explain the use of grouping functions in SQL for aggregated data?
474,What are common errors to avoid when writing complex SQL queries involving joins and aggregates?
474,How do I interpret the results of a SQL query that combines data from multiple tables?
475,How can I write a query to find customers who have placed orders within a specific timeframe?
475,What SQL techniques are commonly used to filter data based on date ranges?
475,Can you explain how to use Common Table Expressions (CTEs) in SQL?
475,What aggregate functions are useful for summarizing sales data in SQL?
475,How do you sort query results based on calculated fields in SQL?
476,How do you write a SQL query that sums values from multiple tables based on a condition?
476,What is the method to filter records for a specific date range in SQL?
476,Can you explain how to join two tables and aggregate results in SQL?
476,What are best practices for naming columns in the result set of a SQL query?
476,How do you ensure that your SQL query runs efficiently when dealing with large datasets?
477,How can I write a query to display total sales by manager while ensuring managers with no sales are included?
477,What is a Common Table Expression (CTE) and how is it used in SQL queries?
477,Can you explain how to join two tables and aggregate data based on certain criteria?
477,What is the purpose of the COALESCE function in SQL, and how does it improve query results?
477,What are some common mistakes to avoid when writing SQL queries that involve joins and aggregation?
478,How can I use window functions to rank products based on sales in SQL?
478,What is the purpose of using a Common Table Expression (CTE) in SQL queries?
478,Can you explain how to calculate total revenue for products using SQL joins?
478,How do I limit the results to the top N rows within each category in SQL?
478,What are the differences between ROW_NUMBER() and other window functions in SQL?
479,What SQL functions are used to filter customers based on their signup date?
479,How can I modify the query to find the top 10 customers instead of the top 5?
479,What common mistakes should I avoid when writing SQL queries involving joins and aggregate functions?
479,Can you explain how the Common Table Expression (CTE) works in this query?
479,What would be the effect of changing the date range in the WHERE clause to two years instead of one?
480,How can I use SQL to rank products by sales and handle ties effectively?
480,What SQL functions should I use to aggregate sales data from different tables?
480,In SQL, how do I limit query results to a specific number of rows, like the top three?
480,What is the purpose of using a Common Table Expression (CTE) in SQL queries?
480,How can I ensure my SQL query is analyzing sales data accurately for a specific year?
481,What is the purpose of using a Common Table Expression (CTE) in SQL?
481,How do you filter results based on aggregate values in SQL?
481,What SQL functions can be utilized to calculate total sales for different groups?
481,Can you explain the process of joining two tables in SQL with an example?
481,What are some common pitfalls to avoid when writing SQL queries involving aggregates and joins?
482,What is the purpose of using LEFT JOIN in SQL queries?
482,How can you modify a query to include departments with no employees while calculating average salaries?
482,What is the function of COALESCE in SQL, and why is it used in this scenario?
482,What are the common pitfalls when using GROUP BY in SQL queries?
482,Can you explain the significance of aggregate functions in data analysis, specifically in relation to salary calculations?
483,How can I write a SQL query to filter data based on specific columns in multiple tables?
483,What is the purpose of using JOIN in SQL queries, and when should it be applied?
483,Can you explain how to use aggregate functions like SUM in SQL to calculate totals?
483,What steps should I take to group results in SQL for better data analysis?
483,How can I adjust a SQL query to include date filters for specific years?
484,What is the purpose of using JOIN in an SQL query?
484,How can I aggregate data from multiple tables using SQL?
484,What are common errors to avoid when writing SQL GROUP BY statements?
484,Can you explain how to sort results in SQL based on aggregated values?
484,What are the best practices for writing SQL queries that involve multiple tables?
485,What is the purpose of using the HAVING clause in aggregate queries?
485,How do you join two tables in SQL and what is a common mistake to avoid?
485,Can you explain how to calculate the average of a specific column in a grouped result set?
485,What modifications would you suggest if we wanted to include departments with an average salary below $50,000?
485,How can you display additional information about the employees along with their average salaries in the query?
486,What SQL techniques can I use to filter records based on a date range?
486,How do I calculate the total for a specific group in SQL?
486,What is the purpose of a Common Table Expression (CTE) in SQL queries?
486,How do I sort the results of a SQL query in descending order?
486,What are the best practices for joining multiple tables in an SQL query?
487,What is the purpose of using the AVG function in SQL queries?
487,How do INNER JOIN and LEFT JOIN differ when working with multiple tables?
487,What SQL concepts should I know to handle cases with empty results in a query?
487,Can you explain why we group by department_name in this SQL example?
487,What are some common mistakes to avoid when writing SQL queries that involve joins and aggregate functions?
488,How can I calculate the average salary for each department in SQL?
488,What SQL query would I use to find the highest-paid department from multiple tables?
488,Can you explain how to join multiple tables in SQL to analyze employee salaries?
488,What are common pitfalls when aggregating data from different tables?
488,How do I limit my SQL query results to only the top entry based on a calculated value?
489,How can I calculate average sales per customer for a specific year using SQL?
489,What is the purpose of using a subquery in SQL for filtering customers?
489,Can you explain the use of JOIN in combining data from multiple tables in SQL?
489,What are common pitfalls to avoid when writing aggregate functions in SQL queries?
489,How do I filter records based on date ranges in SQL queries?
490,How do I write a SQL query to summarize sales by product category over a specific time period?
490,What is the purpose of using a Common Table Expression (CTE) in SQL queries?
490,Can you explain how to filter records based on date ranges in SQL?
490,What SQL functions can be used to aggregate data, like summing sales amounts?
490,How do I join two tables in SQL and group the results based on a specific column?
491,What is a common table expression (CTE) and how is it used in SQL?
491,How can you ensure that months with no sales are included in your SQL results?
491,What are the differences between LEFT JOIN and INNER JOIN in SQL?
491,How do you count unique values from a specific column in SQL?
491,What role does the COALESCE function play in SQL queries, particularly in handling null values?
492,How can I write a SQL query to calculate the total salary for each department in a company?
492,What is the best method to find the department with the highest salary expenditure using SQL?
492,Can you explain how to use Common Table Expressions (CTEs) in SQL for aggregating data?
492,What SQL functions are commonly used to sum values across grouped records?
492,How do JOIN operations work in SQL when combining data from multiple tables?
493,How do I ensure that a query includes products with zero sales in a specific month?
493,What is the purpose of using COALESCE in SQL queries, particularly in revenue calculations?
493,Can you explain the difference between INNER JOIN and LEFT JOIN in the context of this SQL example?
493,What SQL functions can be used to calculate total sales revenue based on quantity and price?
493,How would you modify the query to filter for a different date range or month?
494,What is the purpose of the HAVING clause in SQL, and how does it differ from the WHERE clause?
494,Can you explain how to join multiple tables in a SQL query and provide an example?
494,What are common errors to watch out for when using aggregate functions in SQL?
494,How do you calculate averages in SQL, and what should you consider about data types?
494,In a scenario with multiple departments and varying employee counts, how would you ensure only the relevant departments are included in the results?
495,What SQL query would you use to find customers who made purchases after a specific date?
495,How can aggregate functions like SUM be utilized in SQL queries involving joins?
495,What are the common mistakes to avoid when performing joins between two tables?
495,How do you correctly filter results based on date conditions in SQL?
495,Can you explain the significance of using INNER JOIN as opposed to LEFT JOIN in this context?
496,How can I write a SQL query to aggregate sales data for multiple products?
496,What SQL join types are commonly used for combining data from two tables?
496,What is the purpose of the GROUP BY clause in SQL queries?
496,How do I order the results of a query based on aggregated values?
496,What are some common errors to avoid when writing SQL aggregate functions?
497,How can I write a SQL query to find the most profitable products in a specified time frame?
497,What is the purpose of using GROUP BY in SQL queries, and how does it apply to this example?
497,Could you explain how to filter records based on specific date criteria in SQL?
497,What are the key differences between using INNER JOIN and LEFT JOIN in SQL queries?
497,How would I modify the query to find the top 10 products instead of the top 5?
498,How can I modify the query to include customers with no orders?
498,What would be the outcome if I changed the grouping criteria to include customer_id instead of customer_name?
